<?xml version="1.0" encoding="UTF-8"?>
<Booking xmlns:xsi="http://www.w3.org/2001/XMLSchema-instance"
 xsi:noNamespaceSchemaLocation="http://group17.99k.org/Booking.xsd">
    <OperatorID>2</OperatorID>
    <BookingDate>2012-12-10</BookingDate>
    <BookingTime>19:32:00</BookingTime>
    <PickUpAddress>
        <Street>Sleepy Hickory Road</Street>
        <HouseNo>6</HouseNo>
        <PostCode>W1B1 AH</PostCode>
		<City>London</City>
    </PickUpAddress>
    <DestinationAddress>
        <Street>Rustic Anchor Street</Street>
        <HouseNo>41</HouseNo>
        <PostCode>W1D2 DS</PostCode>
		<City>London</City>
    </DestinationAddress>
	<EstimatedTime>30</EstimatedTime>
    <Name>Barney</Name>
    <PhoneNumber>07553251275</PhoneNumber>
    <Status>NOT COMPLETE</Status>
    <BookingInfo Type="Normal">
        <NormalBooking>
		    <DriverID>16</DriverID>
			<PickUpDate>2012-12-07</PickUpDate>
    		<PickUpTime>20:12:00</PickUpTime>
	    </NormalBooking>
    </BookingInfo>
</Booking>
