<?xml version="1.0" encoding="UTF-8"?>
<Booking xmlns:xsi="http://www.w3.org/2001/XMLSchema-instance"
 xsi:noNamespaceSchemaLocation="http://group17.99k.org/Booking.xsd">
    <OperatorID>1</OperatorID>
    <BookingDate>2012-12-14</BookingDate>
    <BookingTime>19:01:00</BookingTime>
    <PickUpAddress>
        <Street>Queensbury Street</Street>
        <HouseNo>23</HouseNo>
        <PostCode>W13 9TY</PostCode>
		<City>London</City>
    </PickUpAddress>
    <DestinationAddress>
        <Street>Omah Street</Street>
        <HouseNo>32</HouseNo>
        <PostCode>W1D 5PH</PostCode>
		<City>London</City>
    </DestinationAddress>
	<EstimatedTime>20</EstimatedTime>
    <Name>Ben</Name>
    <PhoneNumber>07555001275</PhoneNumber>
    <Status>NOT COMPLETE</Status>
    <BookingInfo Type="Normal">
      <NormalBooking>
			<DriverID>12</DriverID>
			<PickUpDate>2012-12-09</PickUpDate>
    		<PickUpTime>08:30:00</PickUpTime>
	  </NormalBooking>
    </BookingInfo>
</Booking>