<?xml version="1.0" encoding="UTF-8"?>
<Booking xmlns:xsi="http://www.w3.org/2001/XMLSchema-instance"
 xsi:noNamespaceSchemaLocation="http://group17.99k.org/Booking.xsd">
    <OperatorID>3</OperatorID>
    <BookingDate>2012-12-11</BookingDate>
    <BookingTime>15:32:00</BookingTime>
    <PickUpAddress>
        <Street>Little Branch Road</Street>
        <HouseNo>2</HouseNo>
        <PostCode>W120QG</PostCode>
		<City>London</City>
    </PickUpAddress>
    <DestinationAddress>
        <Street>Granville Place</Street>
        <HouseNo>44</HouseNo>
        <PostCode>W84 QX</PostCode>
		<City>London</City>
    </DestinationAddress>
	<EstimatedTime>40</EstimatedTime>
    <Name>Nicky</Name>
    <PhoneNumber>07555001275</PhoneNumber>
    <Status>NOT COMPLETE</Status>
    <BookingInfo Type="Regular">
        <RegularBooking>
            <ClientID>3</ClientID>
            <RepeatOn>
			    <DriverID>15</DriverID>
                <WeekDay>FRIDAY</WeekDay>
                <WeeklyInterval>2</WeeklyInterval>
                <PickUpTime>09:20:00</PickUpTime>
                <PickUpDate>2012-12-14</PickUpDate>
                <RegStatus>ONGOING</RegStatus>
				<TimesComplete>2</TimesComplete>
            </RepeatOn>
        </RegularBooking>
    </BookingInfo>
</Booking>
