<?xml version="1.0" encoding="UTF-8"?>
<Booking xmlns:xsi="http://www.w3.org/2001/XMLSchema-instance"
 xsi:noNamespaceSchemaLocation="http://group17.99k.org/Booking.xsd">
    <OperatorID>5</OperatorID>
    <BookingDate>2012-12-12</BookingDate>
    <BookingTime>08:22:00</BookingTime>
    <PickUpAddress>
        <Street>Anadel Road</Street>
        <HouseNo>46</HouseNo>
        <PostCode>W42 RA</PostCode>
		<City>London</City>
    </PickUpAddress>
    <DestinationAddress>
        <Street>Silver Flower Street</Street>
        <HouseNo>2</HouseNo>
        <PostCode>W12 0TE</PostCode>
		<City>London</City>
    </DestinationAddress>
	<EstimatedTime>60</EstimatedTime>
    <Name>Malfred</Name>
    <PhoneNumber>07555431275</PhoneNumber>
    <Status>CANCELLED</Status>
    <BookingInfo Type="Regular">
        <RegularBooking>
            <ClientID>5</ClientID>
            <RepeatOn>
			    <DriverID>16</DriverID>
                <WeekDay>WEDNESDAY</WeekDay>
                <WeeklyInterval>3</WeeklyInterval>
                <PickUpTime>23:10:00</PickUpTime>
                <PickUpDate>2012-12-19</PickUpDate>
                <RegStatus>CANCELLED</RegStatus>
				<TimesComplete>0</TimesComplete>
            </RepeatOn>
        </RegularBooking>
    </BookingInfo>
</Booking>