<?xml version="1.0" encoding="UTF-8"?>
<Booking xmlns:xsi="http://www.w3.org/2001/XMLSchema-instance"
 xsi:noNamespaceSchemaLocation="http://group17.99k.org/Booking.xsd">
    <OperatorID>5</OperatorID>
    <BookingDate>2012-12-14</BookingDate>
    <BookingTime>12:01:00</BookingTime>
    <PickUpAddress>
        <Street>Anadel Road</Street>
        <HouseNo>46</HouseNo>
        <PostCode>W42 RA</PostCode>
		<City>London</City>
    </PickUpAddress>
    <DestinationAddress>
        <Street>Lone Castle Road</Street>
        <HouseNo>65</HouseNo>
        <PostCode>W41 BH</PostCode>
		<City>London</City>
    </DestinationAddress>
	<EstimatedTime>30</EstimatedTime>
    <Name>Matthew</Name>
    <PhoneNumber>07555451255</PhoneNumber>
    <Status>NOT COMPLETE</Status>
    <BookingInfo Type="Regular">
        <RegularBooking>
            <ClientID>7</ClientID>
            <RepeatOn>
			    <DriverID>15</DriverID>
                <WeekDay>WEDNESDAY</WeekDay>
                <WeeklyInterval>1</WeeklyInterval>
                <PickUpTime>13:00:00</PickUpTime>
                <PickUpDate>2012-12-26</PickUpDate>
                <RegStatus>ONGOING</RegStatus>
				<TimesComplete>0</TimesComplete>
            </RepeatOn>
        </RegularBooking>
    </BookingInfo>
</Booking>