<?xml version="1.0" encoding="UTF-8"?>
<Booking xmlns:xsi="http://www.w3.org/2001/XMLSchema-instance"
 xsi:noNamespaceSchemaLocation="http://group17.99k.org/Booking.xsd">
    <OperatorID>2</OperatorID>
    <BookingDate>2012-12-10</BookingDate>
    <BookingTime>17:30:00</BookingTime>
    <PickUpAddress>
        <Street>Silver Flower Street</Street>
        <HouseNo>2</HouseNo>
        <PostCode>W12 0TE</PostCode>
		<City>London</City>
    </PickUpAddress>
    <DestinationAddress>
        <Street>Sleepy Hickory Road</Street>
        <HouseNo>6</HouseNo>
        <PostCode>W1B 1AH</PostCode>
		<City>London</City>
    </DestinationAddress>
	<EstimatedTime>120</EstimatedTime>
    <Name>Cane</Name>
    <PhoneNumber>07555412275</PhoneNumber>
    <Status>NOT COMPLETE</Status>
    <BookingInfo Type="Normal">
       <NormalBooking>
	        <DriverID>2</DriverID>
			<PickUpDate>2012-12-06</PickUpDate>
    		<PickUpTime>19:00:00</PickUpTime>
	  </NormalBooking>
    </BookingInfo>
</Booking>

