<?xml version="1.0" encoding="UTF-8"?>
<Booking xmlns:xsi="http://www.w3.org/2001/XMLSchema-instance"
 xsi:noNamespaceSchemaLocation="http://group17.99k.org/Booking.xsd">
    <OperatorID>5</OperatorID>
    <BookingDate>2012-12-12</BookingDate>
    <BookingTime>09:21:00</BookingTime>
    <PickUpAddress>
        <Street>Little Branch Road</Street>
        <HouseNo>2</HouseNo>
        <PostCode>W12 0QG</PostCode>
		<City>London</City>
    </PickUpAddress>
    <DestinationAddress>
        <Street>Sunny Bluff Road</Street>
        <HouseNo>51</HouseNo>
        <PostCode>W71 DA</PostCode>
		<City>London</City>
    </DestinationAddress>
	<EstimatedTime>50</EstimatedTime>
    <Name>George</Name>
    <PhoneNumber>07555412275</PhoneNumber>
    <Status>CANCELLED</Status>
    <BookingInfo Type="Normal">
      <NormalBooking>
			<DriverID>12</DriverID>
			<ClientID>7</ClientID>
			<PickUpDate>2012-12-08</PickUpDate>
    		<PickUpTime>09:33:00</PickUpTime>
	  </NormalBooking>
    </BookingInfo>
</Booking>